<!ELEMENT movies (movie*)>
        <!ELEMENT movie (name, director, year, rating)>
        <!ELEMENT name (#PCDATA)>
        <!ELEMENT director (#PCDATA)>
        <!ELEMENT year (#PCDATA)>
        <!ELEMENT rating (#PCDATA)>